"87SRHVGU","journalArticle","2023","Yang, Lidong; Jiang, Xingxing; Li, Xuegang; Zhu, Zhongkui","Self-Supervised Learning With Signal Masking and Reconstruction for Machinery Fault Diagnosis Under Limited Labeled Data and Varying Working Condition","IEEE Sensors Journal","","1530-437X, 1558-1748, 2379-9153","10.1109/JSEN.2023.3309696","https://ieeexplore.ieee.org/document/10238381/","Deep learning methods are promising tools for machinery fault diagnosis in modern industry. However, the diagnostic performance of these methods will deteriorate significantly with insufficient labeled data or varying working condition. To address this problem, a self-supervised learning (SSL) method with self-attention mechanism is proposed for machinery fault diagnosis under limited labeled data and nonstationary working condition. A simple but effective pretext task is first constructed to take full advantage of unlabeled data under varying working condition. By completing the pretext task, a pretrained model is generated for effective feature representation with the constraint of signal masking and reconstruction, thus enhancing the capability of extracting discriminative features. Then, a fine-tuned model, which inherits the capability of feature extraction of pretrained one by knowledge transfer, is built by feeding into few labeled samples. Moreover, with our SSL method, transformer architecture with self-attention mechanism is used as the backbone to enhance the ability of modeling global dependency and extracting temporal information. The experimental results reveal that our method can achieve better diagnostic performance under new working condition by comparing with six advanced methods. Furthermore, a discussion on the capability of reconstruction and the classification effect is performed in this study, which demonstrates the rationality of our designed pretext task.","2023-10-15","2024-03-20 16:15:38","2025-06-01 11:41:13","2024-03-20 16:15:38","24862-24873","","20","23","","IEEE Sensors J.","","","","","","","","en","","","","","DOI.org (Crossref)","","","<div data-schema-version=""9""><p>Anomaly detection + fault classification in 2 parts: one to train self-supervised autoencoder and then use trained Encoder to classify different faults in different working conditions. Good explanations and references of intuitions. Uses signal masking on input. Analyzes latent space with t-SNE. 2 datasets used for validation of approach</p> </div>","; /Users/Adri/Library/CloudStorage/GoogleDrive-adria.molero@upc.edu/Mi unidad/Zotero/storage/P6MHJMC8/Yang et al. - 2023 - Self-Supervised Learning With Signal Masking and R.pdf","notion://www.notion.so/Yang-et-al-2023-00c6490513ab44ee9268b214a7c18f76","1D input; Anomaly detection; Autoencoder; bearings; Deep Learning; Fault classification; High rated; notion; RPlan: A; SCADA data; Transformer","","","","","","","","","","","","","","","","","","","","","","","","","","","","","","","","","","","","","","","","","","","","","","",""
"XJ5PHJCU","journalArticle","2024","Zhu, Jun; Wang, Yuanfan; Huang, Cheng-Geng; Shen, Changqing; Chen, Bojian","A New Incremental Learning for Bearing Fault Diagnosis Under Noisy Conditions Using Classification and Feature-Level Information","IEEE Transactions on Instrumentation and Measurement","","0018-9456, 1557-9662","10.1109/TIM.2023.3330177","https://ieeexplore.ieee.org/document/10313348/","Deep learning has been widely used for fault diagnosis of complex mechanical equipment in recent years. However, fault types keep increasing with the change in the working state of mechanical equipment in practical scenarios, which causes the performance of traditional machine-learning models to degrade rapidly. Incremental learning can continuously learn new knowledge from incremental information while retaining previously learned knowledge, effectively enhancing the generalization performance of the model to meet the needs of fault diagnosis in actual industrial scenarios. Moreover, the noise environment will have a certain effect on the performance of the model. Therefore, this article proposes a new incremental learning method using classification and feature-level information, which aims to improve the robustness of the model under noisy conditions. First, an adaptive dual-branch residual network is constructed, and weights are assigned through an adaptive algorithm to enable the model to retain old knowledge while learning new knowledge. Then, an adversarial network is used to reduce the differences at the feature level after the samples pass through the model of different phases, which ensures the sustainable learning ability of the model and promotes knowledge transfer between different phases. Meanwhile, catastrophic forgetting is overcome through knowledge distillation loss. The comparative experimental results show that the proposed method in this article outperforms the current popular incremental learning method.","2024","2024-03-20 16:05:32","2025-06-01 09:12:16","2024-03-20 16:05:32","1-14","","","73","","IEEE Trans. Instrum. Meas.","","","","","","","","en","","","","","DOI.org (Crossref)","","","<div data-schema-version=""8""><p><span style=""color: rgb(31, 31, 31)""><span style=""background-color: rgb(255, 255, 255)"">Fault classification using GAN and Incremental Learning (to overcome data drift). Uses labeled data in training. GAN is used for novelty detection (new faults). Good idea. Challenge is catastrophical forgetting, i.e., not forget 'old' faults due to adapting to new data or discovering new faults. Uses ResNet for feature extractor (distilled) and preprocessed data as input (FFT). Results are not that good against less complex methods</span></span></p> <p><span style=""color: rgb(31, 31, 31)""><span style=""background-color: rgb(255, 255, 255)"">Quite complex model. Should re read several times. Still unclear GAN application. What about fault prediction?</span></span></p> <p></p> </div>","/Users/Adri/Library/CloudStorage/GoogleDrive-adria.molero@upc.edu/Mi unidad/Zotero/storage/7GU53ISH/getPDF.pdf; ","notion://www.notion.so/Zhu-et-al-2024-8739eb294a3440b1938cee60b9b7c1c0","Classified; Deep Learning; Fault classification; GAN; Good task theory (DL); High rated; Latent space; notion; Processed data; Re-read; Read; RPlan: A; SCADA data; Transfer Learning","","","","","","","","","","","","","","","","","","","","","","","","","","","","","","","","","","","","","","","","","","","","","","",""
"PV2A4ATE","journalArticle","2021","Zaki, Sayed A.; Zhu, Honglu; Fakih, Mohammed Al; Sayed, Ahmed Rabee; Yao, Jianxi","Deep-learning–based method for faults classification of PV system","IET Renewable Power Generation","","1752-1424","10.1049/rpg2.12016","https://onlinelibrary.wiley.com/doi/abs/10.1049/rpg2.12016","The installation of photovoltaic (PV) system, as a renewable energy source, has significantly increased. Therefore, fast and efficient fault detection and diagnosis technique is highly needed to prevent unpredicted power interruptions. This is obtained in this study in the following steps. First, an efficient meta-heuristic algorithm is proposed for extracting the optimal five parameters of the PV model in order to assist the MATLAB simulation model. It is used due to its simplicity and high efficiency in building the PV array simulation. Second, a new PV system deep-learning convolutional neural network (CNN) fault classification method is presented for the advantage of automatic feature extraction, which reduces the computational burden and increases the high classification capability. Finally, for the practical and theoretical validation of the employed CNN model, normal and six fault cases are selected based on different atmospheric conditions. At same time, three electrical indicators are analysed and accordingly chosen as inputs to the proposed classification model. Moreover, the proposed model is compared with other machine-learning models.","2021","2024-03-20 15:55:44","2025-06-01 10:15:09","2024-03-20 15:55:44","193-205","","1","15","","","","","","","","","","en","","","","","Wiley Online Library","","_eprint: https://ietresearch.onlinelibrary.wiley.com/doi/pdf/10.1049/rpg2.12016","<div data-schema-version=""9""><p>CNN for fault classification on photovoltaic data. Simple approach, good results but some confusion between similar faults</p> </div>","/Users/Adri/Library/CloudStorage/GoogleDrive-adria.molero@upc.edu/Mi unidad/Zotero/storage/M8ZTV5J2/Zaki et al. - 2021 - Deep-learning–based method for faults classificati.pdf; ; /Users/Adri/Library/CloudStorage/GoogleDrive-adria.molero@upc.edu/Mi unidad/Zotero/storage/3I5JGE8C/rpg2.html","notion://www.notion.so/Zaki-et-al-2021-bd80f2410c9646dca7334c68e48538d4","CNN; Deep Learning; Fault classification; Latent space; notion; Rplan: A","","","","","","","","","","","","","","","","","","","","","","","","","","","","","","","","","","","","","","","","","","","","","","",""
"7IL3QLYD","journalArticle","2024","Amiri, Ahmed Faris; Kichou, Sofiane; Oudira, Houcine; Chouder, Aissa; Silvestre, Santiago","Fault Detection and Diagnosis of a Photovoltaic System Based on Deep Learning Using the Combination of a Convolutional Neural Network (CNN) and Bidirectional Gated Recurrent Unit (Bi-GRU)","Sustainability","","2071-1050","10.3390/su16031012","https://www.mdpi.com/2071-1050/16/3/1012","The meticulous monitoring and diagnosis of faults in photovoltaic (PV) systems enhances their reliability and facilitates a smooth transition to sustainable energy. This paper introduces a novel application of deep learning for fault detection and diagnosis in PV systems, employing a three-step approach. Firstly, a robust PV model is developed and fine-tuned using a heuristic optimization approach. Secondly, a comprehensive database is constructed, incorporating PV model data alongside monitored module temperature and solar irradiance for both healthy and faulty operation conditions. Lastly, fault classification utilizes features extracted from a combination consisting of a Convolutional Neural Network (CNN) and Bidirectional Gated Recurrent Unit (Bi-GRU). The amalgamation of parallel and sequential processing enables the neural network to leverage the strengths of both convolutional and recurrent layers concurrently, facilitating effective fault detection and diagnosis. The results affirm the proposed technique’s efficacy in detecting and classifying various PV fault types, such as open circuits, short circuits, and partial shading. Furthermore, this work underscores the significance of dividing fault detection and diagnosis into two distinct steps rather than employing deep learning neural networks to determine fault types directly.","2024-01-24","2024-03-20 15:53:44","2025-06-01 10:44:10","2024-03-20 15:53:44","1012","","3","16","","Sustainability","","","","","","","","en","","","","","DOI.org (Crossref)","","","<div data-schema-version=""9""><p>Fault classification on PV data using 1DCNN + Bi-RNN (bidirectional to capture past and 'future' data). First CNN to extract features and then Bi-RNN to process them (then FC and softmax). Uses 2 models: 1 for binary classification (fault detected or not) and another for fault classification (among different fault types). Generates synthetic data</p> </div>","/Users/Adri/Library/CloudStorage/GoogleDrive-adria.molero@upc.edu/Mi unidad/Zotero/storage/2HE9SHCW/Amiri et al. - 2024 - Fault Detection and Diagnosis of a Photovoltaic Sy.pdf; ","notion://www.notion.so/Amiri-et-al-2024-9f6a58f682d64f70ba388a7577977c10","Anomaly detection; Deep Learning; Ensemble; Fault classification; notion; PV system; SCADA data","","","","","","","","","","","","","","","","","","","","","","","","","","","","","","","","","","","","","","","","","","","","","","",""
"QPCPB4VB","journalArticle","2020","Wang, Hui; Xu, Jiawen; Yan, Ruqiang; Sun, Chuang; Chen, Xuefeng","Intelligent Bearing Fault Diagnosis Using Multi-Head Attention-Based CNN","Procedia Manufacturing","","23519789","10.1016/j.promfg.2020.07.005","https://linkinghub.elsevier.com/retrieve/pii/S2351978920316577","Abstract Aibmstirnagctat automatic feature extraction and fault recognition of rolling bearings, a new data-driven intelligent fault diagnosis approach using mAiumltin-hgeatd aautteonmtiaotnicafnedatcuorneveoxlturtaioctnioalnnaenudraflanueltwreocrkog(nCiNtioNn) oisf prorollpinogsebde. aFriirnsgtlsy,,aa nsiemwpdleatsai-gdnraivl-eton-imntaeglleigsepnattifaalutlrtadnisafognrmosmiseatphpordoiascuhtiuliszinedg tmAoiumgltein-hegeratdeaa2utDteonmgtriaoatynicaimfnedagtcueorsnevweoixlttuhrtiainoctndioaiflnfneareenundrtaflhaneuealtlwthreoscrtkoagt(enCsiNtiforNon)moisfraprworollpbinoegsaerbidne.gaFrviirnisbgtrlsya,t,iaaonsiesmwigpndlealtssai,-gdanrnaidvl-etgone-nimnetraeagltleidgsepinmattaifagaleutslrtaadnreisafdoginrvmoisdmiesdeatprhaponrddooiascmuhltyiuliszninetdog tmroauiglntein-hegeradtdeataa2tDteangdtrioatynesaitmnindaggceodsnatvwao.iltuhStieincoondnaifdlflneyre,eunwrtaelhneaeadtlowthpotsrtktaht(eCsmNfruNol)tmii-shreapawrdopbaoetsaterindnt.giFonvirisbmtrlyaet,cihaoansnismisigmpnleatlossi,goanpnatdlim-tgoiez-niemertahagteedCspiNmaNtaiaglsettsrruaacnrtesufrdoeirvmaidnmdededtrheaovndedloispmulatyilnizneetwdo ctrooanignveionlegurtaidtoaenta2lDannegdtrwatyeosritkminmaggoeddsaetwlaf.iothSrienicnotdenilfdlfilegyre,ennwttebheeaaadrliotnhpgtsfttahutelstmdfruioalgtmin-horeasaiwsd. bNaeteatexrintn,tgitohnveibtmrraaeitcnihoinanngsisdigmantatloiss,ouapsntedidmgtieozneterrtahaitneednCeiNtmwNaogrsektsrpuaacrrteuamrdeievatiednrdesdodrfeavtnhedelodpmelsayigninneetwod CctroaNninNvionmlguotiddoaentlatloannaedctwctueorsratktienmlgyodrdeaeatlalif.zoeSrebicneotaenrlidlnilgye,fnawtuebltearedrcionopggtnftaihtuieoltnmd. uiFaligtnin-aholelsyais,d.thNaetetedxnti,atigtohnneostmtriaecicnphienarngfiosdrmamtaatnoisceoupsotefidmthtioezeptrrtaohipneonCseNtdwNboersaktrripunacgrtuadmrieaegatnenrodssiodsfefvtrhaeemlodepewsaoigrnkneewids vCcoeNrniNvfioemlduotoidonenldatiloffneaerctewcnuotrraskutebml-yodrdaeteallsifezotesr buinentaderleilnrigwefonartukblitenragercilnogagdnfsaituioolftn0d.~iFa3ignnhaoplls,yias,n.tdhNecedoxtim,agpthnaeroisttroiacninpeienxrpgfoedriammtaaeninsctesusoaerfedthatoelspotrracoiopnnondseutdcwtbeoderakwripintaghradomitahegetnerroCssNiosfNftrhamemodedewesloisgrknaneids bvCeNrairNfiinemgdofodanueldttiofdfieaarcgecnuotrsasiutseblm-yderatethaolsideztses. buEenxadpreienrrgiwmfoearnuktlitnrrgeescluolagtsdnsisthiooofnw0.~Ft3hinahatpltl,hyae,ntpdhrecodopimoasgpenadroisdtoiiacngpneeoxrspftoeicrimmmaeenntchtesooadrfectahanelspoacrcohopienovdseuedcetfbefdeeacwrtiinvtghe dobiteahagernrinoCgsNisfaNfuralmtmodediwaeglosnrokasnids wbveirathirfiinreegdlafotainvueldtliyfdfifeaergweneotrssCiusNbm-Ndeatmthaosdetses.l uEpnaxdrpaeemrriwemtoeernskt,inargensdluohlatasdsssshoofmw0e~tg3heahntpet,rhaaelnizpdartcoiopmonspaeabdriildsitoiyan.gTneoxhspeteircreicmmoegennthtistoiadornecaraanltseoacochfoibenevdaeurcientfegfdescwttaiitvtehes oubtnehadererirnCgwNofaNrkuilmnt goddilaoegalsndosasnoidsf 0wb~eiat3hrihnrpeglafltalivureltlaycdhfiaeogwvneeorrsCi9s9Nm%Ne.tmhodse.l Epaxrpaemriemteernst, arnesduhltasssshoomwe tgheantetrhaelizpartoipoonsaebdilditiya.gTnohsetircecmogenthitoidoncaranteacohf ibeevaerienfgfescttaitvees ubneadreirngwofarkuilnt gdilaogandossoisf 0w~it3hhrpelaltlivrelaychfeowveerrC99N%N. model parameters, and has some generalization ability. The recognition rate of bearing states under working loads of ©0~230h1p9aTllhreeAacuhthoovresr. 9P9u%bl.ished by Elsevier B.V.","2020","2024-03-27 09:58:43","2025-06-01 11:05:17","2024-03-27 09:58:43","112-118","","","49","","Procedia Manufacturing","","","","","","","","en","","","","","DOI.org (Crossref)","","","<div data-schema-version=""9""><p>Fault classification of bearings vibration data using CNN + multihead attention. Preprocess vibration data by converting it to gray image (2D data) for CNN. Unclear results. Balanced data for healthy and different faulty states</p> </div>","; /Users/Adri/Library/CloudStorage/GoogleDrive-adria.molero@upc.edu/Mi unidad/Zotero/storage/XAPEZ4LY/Wang et al. - 2020 - Intelligent Bearing Fault Diagnosis Using Multi-He.pdf","notion://www.notion.so/Wang-et-al-2020-04c49727a72b4860b53fb60cb5c38488","2D input; Attention; bearings; Deep Learning; Ensemble (CNN + Attention); Fault classification; notion; RPlan: A; SCADA data","","","","","","","","","","","","","","","","","","","","","","","","","","","","","","","","","","","","","","","","","","","","","","",""
"WJYVHJIT","journalArticle","2023","Zhang, Kai; Li, Zhixuan; Zheng, Qing; Ding, Guofu; Tang, Baoping; Zhao, Minghang","Fault Diagnosis With Bidirectional Guided Convolutional Neural Networks Under Noisy Labels","IEEE Sensors Journal","","1530-437X, 1558-1748, 2379-9153","10.1109/JSEN.2023.3289948","https://ieeexplore.ieee.org/document/10171174/","In recent years, supervised deep learning methods have proven to be feasible and advanced for fault diagnosis. They do, however, rely on large amounts of accurately labeled data. It is challenging to accurately label incipient or secondary fault signals in the presence of operational background noise, resulting in noisy labels. This study presents a bidirectional guidance method that enables deep networks to diagnose faults robustly with the ability to label noise tolerance. First, the proposed method uses discrete wavelet packet transform (DWPT) to preprocess vibration signals before feeding them into the deep convolutional network. Second, a bidirectional loss (BL) function is proposed to significantly improve the robustness of the model in the case of noisy labels. Third, a fast cosine decay (FCD) strategy of the learning rate is designed to further boost the recognition performance of the model under severe noisy labels. The proposed method is applied to testbed experiments and wind turbine fault diagnosis. The experimental results demonstrate that it outperforms other cutting-edge methods in fault diagnosis with severely noisy labels.","2023-08-15","2024-04-17 15:25:24","2025-05-30 14:10:33","2024-04-17 15:25:24","18810-18820","","16","23","","IEEE Sensors J.","","","","","","","","en","https://ieeexplore.ieee.org/Xplorehelp/downloads/license-information/IEEE.html","","","","DOI.org (Crossref)","","","<p style=""margin: 0.0px 0.0px 0.0px 0.0px; font: 12.0px Helvetica; color: #1f1f1f; -webkit-text-stroke: #1f1f1f; background-color: #ffffff;""><span style=""font-family: 'Helvetica'; font-weight: normal; font-style: normal; font-size: 12.00px; font-kerning: none;"">Fault diagnosis of turbine faults with noisy labels using CNN with vibration data and processed by discrete wavelet transform to 2D input. Uses bidirectional loss to increase robustness. Several adjustments to improve robustness that may lead to poor generalization</span></p>","; /Users/Adri/Library/CloudStorage/GoogleDrive-adria.molero@upc.edu/Mi unidad/Zotero/storage/PUF63NVW/Zhang et al. - 2023 - Fault Diagnosis With Bidirectional Guided Convolut.pdf","notion://www.notion.so/Zhang-et-al-2023-637630533edd441f972915cd7bd22712","2D input; Anomaly detection; Classified; CNN; Data handling techniques; Deep Learning; Fault classification; notion; Processed data; Read; RPlan: A","","","","","","","","","","","","","","","","","","","","","","","","","","","","","","","","","","","","","","","","","","","","","","",""
"U7ZYCVKB","journalArticle","2023","Deng, Congying; Deng, Zihao; Lu, Sheng; He, Mingge; Miao, Jianguo; Peng, Ying","Fault Diagnosis Method for Imbalanced Data Based on Multi-Signal Fusion and Improved Deep Convolution Generative Adversarial Network","Sensors","","1424-8220","10.3390/s23052542","https://www.mdpi.com/1424-8220/23/5/2542","The realization of accurate fault diagnosis is crucial to ensure the normal operation of machines. At present, an intelligent fault diagnosis method based on deep learning has been widely applied in mechanical areas due to its strong ability of feature extraction and accurate identiﬁcation. However, it often depends on enough training samples. Generally, the model performance depends on sufﬁcient training samples. However, the fault data are always insufﬁcient in practical engineering as the mechanical equipment often works under normal conditions, resulting in imbalanced data. Deep learning-based models trained directly with the imbalanced data will greatly reduce the diagnosis accuracy. In this paper, a diagnosis method is proposed to address the imbalanced data problem and enhance the diagnosis accuracy. Firstly, signals from multiple sensors are processed by the wavelet transform to enhance data features, which are then squeezed and fused through pooling and splicing operations. Subsequently, improved adversarial networks are constructed to generate new samples for data augmentation. Finally, an improved residual network is constructed by introducing the convolutional block attention module for enhancing the diagnosis performance. The experiments containing two different types of bearing datasets are adopted to validate the effectiveness and superiority of the proposed method in single-class and multi-class data imbalance cases. The results show that the proposed method can generate high-quality synthetic samples and improve the diagnosis accuracy presenting great potential in imbalanced fault diagnosis.","2023-02-24","2024-04-17 15:24:49","2025-06-01 16:35:11","2024-04-17 15:24:49","2542","","5","23","","Sensors","","","","","","","","en","https://creativecommons.org/licenses/by/4.0/","","","","DOI.org (Crossref)","","","<div data-schema-version=""8""><p><span style=""color: rgb(0, 0, 0)""><span style=""background-color: rgb(255, 255, 255)"">Fault diagnosis method that first preprocesses with a CWT to move from time series to images, then fuses all sensors signals with avg pooling and then trains a GAN to solve imbalance issue and finally performs fault classification using a CNN with attention module. Good architecture design. Data from bearings</span></span></p> </div>","/Users/Adri/Library/CloudStorage/GoogleDrive-adria.molero@upc.edu/Mi unidad/Zotero/storage/VAJYF3KL/Deng et al. - 2023 - Fault Diagnosis Method for Imbalanced Data Based o.pdf; ","notion://www.notion.so/Deng-et-al-2023-973e28527ec9415eae88863b1667717e","2D input; Attention; bearings; Classified; CNN; Data handling techniques; Deep Learning; Fault classification; GAN; Good task theory (DL); High rated; Latent space; notion; Processed data; Read; RPlan: A; t-SNE visualization","","","","","","","","","","","","","","","","","","","","","","","","","","","","","","","","","","","","","","","","","","","","","","",""
"W2483D5I","journalArticle","2023","An, Zining; Wu, Fan; Zhang, Cong; Ma, Jinhao; Sun, Bo; Tang, Bihua; Liu, Yuanan","Deep Learning-Based Composite Fault Diagnosis","IEEE Journal on Emerging and Selected Topics in Circuits and Systems","","2156-3357, 2156-3365","10.1109/JETCAS.2023.3262241","https://ieeexplore.ieee.org/document/10083040/","As the core component of many large machinery, rotating equipment occupies a high proportion in industrial manufacturing. Intelligent fault diagnosis for them is becoming the core focus of Industry 4.0 and its evolution. To address the problem of poor fault classification accuracy of rotating equipment, this paper proposes a new solution to deploy a composite fault diagnosis model at the front end to achieve low power consumption, continuous automatic identification and monitoring of equipment faults. We creatively combined the idea of speech recognition to solve the problem that traditional feature extraction methods are insufficient in handling composite fault diagnosis when dealing with fault waveform files, and used Fbank speech feature extraction idea to extract fault features, thus simplifying the complex fault diagnosis problem into an image classification problem. The generated composite fault Fbank feature data set is significantly different in visual observation. Therefore, we further designed the LeNet-F network based on the LeNet network for composite fault diagnosis. The model was validated on the K210 development board to achieve an accuracy of 97.41% for hybrid fault classification at a model size of 2.4MB. This makes it possible to apply the deep learning method to the front end to directly complete the composite fault diagnosis.","2023-06","2024-04-17 15:23:45","2025-05-30 14:13:04","2024-04-17 15:23:45","572-581","","2","13","","IEEE J. Emerg. Sel. Topics Circuits Syst.","","","","","","","","en","https://ieeexplore.ieee.org/Xplorehelp/downloads/license-information/IEEE.html","","","","DOI.org (Crossref)","","","<p>14 fault classification using CNN on vibration data (after preprocessing frequency domain and mel filter). Composite faults.</p>","/Users/Adri/Library/CloudStorage/GoogleDrive-adria.molero@upc.edu/Mi unidad/Zotero/storage/93BFFH63/An et al. - 2023 - Deep Learning-Based Composite Fault Diagnosis.pdf; ","notion://www.notion.so/An-et-al-2023-6dfa0f257d064f00ab8b61147c1c79ea","1D input; Classified; CNN; Data handling techniques; Fault classification; Good task theory (DL); NN; notion; Processed data; Read; RPlan: A","","","","","","","","","","","","","","","","","","","","","","","","","","","","","","","","","","","","","","","","","","","","","","",""
