"VT5BKGAS","journalArticle","2023","Che, Shouquan; Lu, Jianfeng; Bao, Congwang; Zhang, Caihong; Liu, Yongzhi","Multiscale Time-Frequency Sparse Transformer Based on Partly Interpretable Method for Bearing Fault Diagnosis","Shock and Vibration","","1875-9203, 1070-9622","10.1155/2023/1639287","https://www.hindawi.com/journals/sv/2023/1639287/","Transformer model is being gradually studied and applied in bearing fault diagnosis tasks, which can overcome the feature extraction defects caused by long-term dependencies in convolution neural network (CNN) and recurrent neural network (RNN). To optimize the structure of existing transformer-like methods and improve the diagnostic accuracy, we proposed a novel method based on the multiscale time-frequency sparse transformer (MTFST) in this paper. First, a novel tokenizer based on shot-time Fourier transform (STFT) is designed, which processes the 1D format raw signals into 2D format discrete time-frequency sequences in the embedding space. Second, a sparse self-attention mechanism is designed to eliminate the feature mapping defect in naive self-attention mechanism. Then, the novel encoder-decoder structure is presented, the multiple encoders are employed to extract the hidden feature of different time-frequency sequences obtained by STFT with different window widths, and the decoder is used to remap the deep information and connect to the classifier for discriminating fault types. The proposed method is tested in the XJTU-SY bearing dataset and self-made experiment rig dataset, and the following work is conducted. The influences of hyperparameters on diagnosis accuracy and number of parameters are analysed in detail. The weights of the attention mechanism (AM) are visualized and analysed to study the interpretability, which explains the partly working pattern of the network. In the comparison test with other existing CNN, RNN, and transformer models, the diagnosis accuracy of different methods is statistically analysed, feature vectors are presented via the t-distributed stochastic neighbor embedding (t-SNE) method, and the proposed MTFST obtains the best accuracy and feature distribution form. The results demonstrate the effectiveness and superiority of the proposed method in bearing fault diagnosis.","2023-08-04","2024-12-16 12:03:02","2025-05-30 14:12:57","2024-12-16 12:03:02","1-21","","","2023","","Shock and Vibration","","","","","","","","en","https://creativecommons.org/licenses/by/4.0/","","","","DOI.org (Crossref)","","","<div data-schema-version=""9""><p>This paper proposes how a transformer architecture for fault diagnosis (classification) in bearings vibration data. Preprocess vibration data to obtain TFR (time-frequency representations) from STFT (Short Time Fourier Transform). Uses 3 Encoders and then one decoder and lastly a classification layer. Analyses thoroughly attention maps from output of each encoder and decoder. Also analyses latent space with t-SNE. Good paper but too focused on classification accuracy and maybe too complex on the details and task. Curious thing is that connects directly encoder output to decoder (decoder does not get original input)</p> </div>","/Users/Adri/Library/CloudStorage/GoogleDrive-adria.molero@upc.edu/Mi unidad/Zotero/storage/DMX49KE7/Che et al. - 2023 - Multiscale Time-Frequency Sparse Transformer Based.pdf; ","notion://www.notion.so/Che-et-al-2023-15e3c3c2f8f2815a8502f2282d82fd6c","2D input; Attention; Autoencoder; bearings; Classified; Data handling techniques; Dataset; Deep Learning; Fault classification; Good Autoencoder theory; Good time series theory; Industrial data; Interpretability; Latent space; notion; Potential reference; Re-read; Read; RPlan: A; state of the art; t-SNE visualization; To read for paper; Transformer","","Jiang, Xingxing","","","","","","","","","","","","","","","","","","","","","","","","","","","","","","","","","","","","","","","","","","","","",""
"8KH8JTC6","journalArticle","2020","Arellano-Espitia, Francisco; Delgado-Prieto, Miguel; Martinez-Viol, Victor; Saucedo-Dorantes, Juan Jose; Osornio-Rios, Roque Alfredo","Deep-Learning-Based Methodology for Fault Diagnosis in Electromechanical Systems","Sensors","","1424-8220","10.3390/s20143949","https://www.mdpi.com/1424-8220/20/14/3949","Fault diagnosis in manufacturing systems represents one of the most critical challenges dealing with condition-based monitoring in the recent era of smart manufacturing. In the current Industry 4.0 framework, maintenance strategies based on traditional data-driven fault diagnosis schemes require enhanced capabilities to be applied over modern production systems. In fact, the integration of multiple mechanical components, the consideration of multiple operating conditions, and the appearance of combined fault patterns due to eventual multi-fault scenarios lead to complex electromechanical systems requiring advanced monitoring strategies. In this regard, data fusion schemes supported with advanced deep learning technology represent a promising approach towards a big data paradigm using cloud-based software services. However, the deep learning models’ structure and hyper-parameters selection represent the main limitation when applied. Thus, in this paper, a novel deep-learning-based methodology for fault diagnosis in electromechanical systems is presented. The main beneﬁts of the proposed methodology are the easiness of application and high adaptability to available data. The methodology is supported by an unsupervised stacked auto-encoders and a supervised discriminant analysis.","2020-07-16","2024-10-23 15:05:34","2025-06-01 16:37:38","2024-10-23 15:05:34","3949","","14","20","","Sensors","","","","","","","","en","https://creativecommons.org/licenses/by/4.0/","","","","DOI.org (Crossref)","","","<div data-schema-version=""8""><p><span style=""color: rgb(0, 0, 0)""><span style=""background-color: rgb(255, 255, 255)"">Good paper on using stacked sparse (?) autoencoders for fault diagnosis. Uses mechanical vibration and stator current as input, preprocess them to obtain, time, time-frequency, and frequency per each. And then uses 3 layers of stacked AE per each of the resulted preprocesses to eventually use a NN for fusion of the output of the encoders of them for classifying. So it basically trains an encoder to learn and uses its learning to classify fault. Good latent space evaluation (PCA I guess although not noted) and trace reconstruction for interpretability</span></span></p> </div>","/Users/Adri/Library/CloudStorage/GoogleDrive-adria.molero@upc.edu/Mi unidad/Zotero/storage/S8D4XXPN/Arellano-Espitia et al. - 2020 - Deep-Learning-Based Methodology for Fault Diagnosi.pdf; ","notion://www.notion.so/Arellano-Espitia-et-al-2020-1283c3c2f8f281e2adc9e65584d81b84","1D input; Anomaly detection; Autoencoder; Classified; Custom Test bench results validation; Data handling techniques; Fault classification; High rated; Interpretability; Latent space; NN; notion; PCA visualization; Read; RPlan: A; Sparse autoencoders","","","","","","","","","","","","","","","","","","","","","","","","","","","","","","","","","","","","","","","","","","","","","","",""
"2CVM9HF3","journalArticle","2024","Chen, Chong; Wang, Tao; Lu, Kaijie; Liu, Ying; Cheng, Lianglun","Compact convolutional transformers- generative adversarial network for compound fault diagnosis of industrial robot","Engineering Applications of Artificial Intelligence","","09521976","10.1016/j.engappai.2024.109315","https://linkinghub.elsevier.com/retrieve/pii/S0952197624014738","The safe operation of Industrial robots is a major concern in intelligent manufacturing. Accurate compound fault diagnosis is essential to the safe operation of industrial robots, while it is challenging to achieve since the compound fault samples are hard to be collected. Generative adversarial network (GAN) is a useful tool for addressing the data imbalance issue. However, the computation efficiency of GAN in addressing the data imbalance issue has not been investigated. Hence, this study proposes a lightweight GAN named compact con­ volutional Transformers-GAN (CCT-GAN) to alleviate the data imbalance issue in compound fault diagnosis modelling. Firstly, the feedback current signals collected from the industrial robot are transformed into timefrequency images via continuous wavelet transformation (CWT). Secondly, CCT-GAN is designed to achieve high-quality fake data generation and compound fault diagnosis modelling without large computational costs. Thirdly, the relation between a single fault and the compound fault is considered in the compound fault diagnosis modelling via multi-hot representation to alleviate the data imbalance issue. An experimental study based on the real-world compound fault dataset of industrial robots reveals that the proposed CCT-GAN shows merits in compound fault diagnosis modelling in comparison with the prevailing algorithms. The results indicate that CCTGAN can performance of compound fault diagnosis when only 100 data samples from each compound fault category are available.","2024-12","2024-11-15 16:34:32","2025-05-30 14:09:40","2024-11-15 16:34:32","109315","","","138","","Engineering Applications of Artificial Intelligence","","","","","","","","en","","","","","DOI.org (Crossref)","","","<div data-schema-version=""8""><p><span style=""color: rgb(0, 0, 0)""><span style=""background-color: rgb(255, 255, 255)"">Approach to compound fault diagnosis on industrial robots (were faults are typically transferred) using GAN to address the imbalance issue. Uses CNN as backbone but also transformer for the discriminator and learning of sequential patterns (attention mechanism). Good paper on the technical side although results are not excellent and are super fine tuned and complex</span></span></p> </div>","/Users/Adri/Library/CloudStorage/GoogleDrive-adria.molero@upc.edu/Mi unidad/Zotero/storage/28W3M5SY/Chen et al. - 2024 - Compact convolutional transformers- generative adv.pdf; ","notion://www.notion.so/Chen-et-al-2024-13f3c3c2f8f28133841af0375c3884aa","2D input; Attention; Classified; GAN; Good task theory (DL); Industrial data; notion; Read; RPlan: A; Transformer","","","","","","","","","","","","","","","","","","","","","","","","","","","","","","","","","","","","","","","","","","","","","","",""
"ZUW28WN5","journalArticle","2016","Wang, Lukun; Zhao, Xiaoying; Pei, Jiangnan; Tang, Gongyou","Transformer fault diagnosis using continuous sparse autoencoder","SpringerPlus","","2193-1801","10.1186/s40064-016-2107-7","http://springerplus.springeropen.com/articles/10.1186/s40064-016-2107-7","This paper proposes a novel continuous sparse autoencoder (CSAE) which can be used in unsupervised feature learning. The CSAE adds Gaussian stochastic unit into activation function to extract features of nonlinear data. In this paper, CSAE is applied to solve the problem of transformer fault recognition. Firstly, based on dissolved gas analysis method, IEC three ratios are calculated by the concentrations of dissolved gases. Then IEC three ratios data is normalized to reduce data singularity and improve training speed. Secondly, deep belief network is established by two layers of CSAE and one layer of back propagation (BP) network. Thirdly, CSAE is adopted to unsupervised training and getting features. Then BP network is used for supervised training and getting transformer fault. Finally, the experimental data from IEC TC 10 dataset aims to illustrate the effectiveness of the presented approach. Comparative experiments clearly show that CSAE can extract features from the original data, and achieve a superior correct differentiation rate on transformer fault diagnosis.","2016-12","2024-11-19 19:15:19","2025-06-01 09:06:44","2024-11-19 19:15:19","448","","1","5","","SpringerPlus","","","","","","","","en","","","","","DOI.org (Crossref)","","","<div data-schema-version=""9""><p>Paper on fault recognition of EE transformer faults by its dissolved gas concentrations. Uses 2 layers of sparse autoencoders (hidden layers are bigger than input and output layers though). A bit outdated now but good simple example of fault recognition.</p> </div>","; /Users/Adri/Library/CloudStorage/GoogleDrive-adria.molero@upc.edu/Mi unidad/Zotero/storage/SF6ZFIIX/Wang et al. - 2016 - Transformer fault diagnosis using continuous spars.pdf","notion://www.notion.so/Wang-et-al-2016-1433c3c2f8f28135a705e3d48810c7e9","1D input; Anomaly detection; Autoencoder; Classified; DBN; Deep Learning; Fault classification; notion; Read; RPlan: A","","","","","","","","","","","","","","","","","","","","","","","","","","","","","","","","","","","","","","","","","","","","","","",""
"548PD369","journalArticle","2025","Zhao, Pengcheng; Zhang, Wei; Cao, Xiaoshan; Li, Xiang","Denoising diffusion probabilistic model-enabled data augmentation method for intelligent machine fault diagnosis","Engineering Applications of Artificial Intelligence","","09521976","10.1016/j.engappai.2024.109520","https://linkinghub.elsevier.com/retrieve/pii/S0952197624016786","Bearing fault is one of the main causes of rotating machinery failure. However, collecting sufficient failure data proves challenging in real-world industrial environments due to their complexity. Owing to this constraint, the majority of current methods fail to accurately identify fault types with limited data, thereby impeding timely maintenance efforts. To address this issue, we propose a bearing fault diagnosis method utilizing diffusion model data enhancement in this study. Following data collection, we employ the continuous wavelet transform to convert various one-dimensional vibration data into two-dimensional time series graphs. Subsequently, these feature graphs are partitioned into sets of fault samples. Then, the diffusion model is employed to augment the training samples. These augmented samples are then fed into the convolutional neural network for fault diag­ nosis, and their diagnostic accuracy is compared with that of the original dataset. The comparative analysis demonstrates that the data augmentation technique, founded on the diffusion model, enhances fault diagnosis accuracy within a small sample training dataset. Ultimately, the efficacy of the proposed method is validated utilizing the Paderborn bearing dataset and juxtaposed against alternative data augmentation techniques. The findings indicate that the diffusion model-based data augmentation method outperforms other techniques in terms of both training accuracy and stability, particularly in scenarios with small sample.","2025-01","2024-11-15 16:34:42","2025-05-30 14:04:30","2024-11-15 16:34:42","109520","","","139","","Engineering Applications of Artificial Intelligence","","","","","","","","en","","","","","DOI.org (Crossref)","","","<div data-schema-version=""9""><p>Paper that presents the use of diffusion models to enhance data generation and thus improve fault diagnosis. Focuses on diagnosis accuracy improvement using diffusion models that synthetically generate more data samples. Converts raw vibration signals of bearings to 2D using continuous wavelet transform as diffusion models seem to not work well with time-series data. Then uses U-net as the diffusion model to add and reduce noise for samples to generate a feature space that later will be fed to a CNN for fault diagnosis classification (fault type)</p> </div>","; /Users/Adri/Library/CloudStorage/GoogleDrive-adria.molero@upc.edu/Mi unidad/Zotero/storage/DS6GLYK5/Zhao et al. - 2025 - Denoising diffusion probabilistic model-enabled da.pdf","notion://www.notion.so/Zhao-et-al-2025-13f3c3c2f8f281e4a6ebfb96ffef607f","2D input; Anomaly detection; bearings; Classified; CNN; Diffusion models; Fault classification; Good task theory (DL); notion; Oversampling; Processed data; Read; RPlan: A; state of the art; Testbench data","","","","","","","","","","","","","","","","","","","","","","","","","","","","","","","","","","","","","","","","","","","","","","",""
"HD9N9BKJ","journalArticle","2025","Zhu, Yaoqian; Zhang, Cheng; Zhang, Ridong; Gao, Furong","Design of model fusion learning method based on deep bidirectional GRU neural network in fault diagnosis of industrial processes","Chemical Engineering Science","","00092509","10.1016/j.ces.2024.120884","https://linkinghub.elsevier.com/retrieve/pii/S0009250924011849","This paper proposes an end-to-end model fusion feature learning method based on deep bidirectional gated recurrent unit (MCNN-DBiGRU) for fault diagnosis in industrial processes. First, a feature-aligned multi-scale feature extraction model (MCNN) is designed by analyzing the working principles of convolutional and pooling layers of convolutional neural networks. Secondly, a deep bidirectional mechanism is proposed to better extract the time series features in the process data. This mechanism makes the recurrent neural network not only present the forward processing input features from the past to the future, but also the reverse processing from the future to the past. By integrating these features, the diagnostic performance of the network model is improved. To verify that the proposed model has effective diagnostic accuracy for fault diagnosis, we conduct simulation experiments on the Tennessee-Eastman (TE) process and a chemical coking furnace, and compare with several conventional network models. In the end, not only the effectiveness of the model is proved, but it is also confirmed that the model is superior to other conventional neural networks in both diagnostic accuracy and feature robustness.","2025-02","2024-11-15 14:57:11","2025-05-30 14:03:38","2024-11-15 14:57:11","120884","","","302","","Chemical Engineering Science","","","","","","","","en","","","","","DOI.org (Crossref)","","","<div data-schema-version=""9""><p>Model for anomaly detection and fault diagnosis in chemical process. Theory super well-explained (maybe going to deep in basic concepts). Uses several CNN as first step for feature space learning and then several layers of bi directional GRUs for spatial learning. Justifies chemical processes as being different than the ones normally researched (bearing, vibration, etc.). Simulation data where faults have been introduced in several hours of simulation. Interestingly enough, there are more data with faults than with healthy ones in both training and test data.</p> </div>","; /Users/Adri/Library/CloudStorage/GoogleDrive-adria.molero@upc.edu/Mi unidad/Zotero/storage/IJYCS7S8/Zhu et al. - 2025 - Design of model fusion learning method based on de.pdf","notion://www.notion.so/Zhu-et-al-2025-13f3c3c2f8f281b281e3ec1a2c425f3d","1D input; Anomaly detection; Classified; CNN; Deep Learning; Fault classification; Good task theory (DL); Good time series theory; Industrial data; Latent space; notion; Read; RPlan: A; SCADA data; t-SNE visualization","","","","","","","","","","","","","","","","","","","","","","","","","","","","","","","","","","","","","","","","","","","","","","",""
"YDJUXMZL","conferencePaper","2020","Matzka, Stephan","Explainable Artificial Intelligence for Predictive Maintenance Applications","2020 Third International Conference on Artificial Intelligence for Industries (AI4I)","978-1-7281-8701-3","","10.1109/AI4I49448.2020.00023","https://ieeexplore.ieee.org/document/9253083/","This paper presents and provides a realistic, yet synthetic, predictive maintenance dataset for use in this paper and by the community. An explainable model and an explanatory interface are described, trained using the dataset, and their explanatory performance evaluated and compared.","2020-09","2025-04-04 10:33:27","2025-05-30 14:28:27","2025-04-04 10:33:27","69-74","","","","","","","","","","","IEEE","Irvine, CA, USA","en","https://ieeexplore.ieee.org/Xplorehelp/downloads/license-information/IEEE.html","","","","DOI.org (Crossref)","","","<div data-schema-version=""9""><p>This paper provides an explainable tool wear failure mode detection using Decision Trees. It uses the features used from the decision trees as explainability.</p> </div>","/Users/Adri/Library/CloudStorage/GoogleDrive-adria.molero@upc.edu/Mi unidad/Zotero/storage/5T4HLUEA/Matzka - 2020 - Explainable Artificial Intelligence for Predictive.pdf; ","notion://www.notion.so/Matzka-2020-1cb3c3c2f8f2817daa09dcf64ea11226","Computer Science - Machine Learning; Fault classification; notion; 1D input; Classified; Read; Processed data; Industrial data; RPlan: A","","","","","","","","","","","","","","","","","","","","","","","","","","","","","","","","2020 Third International Conference on Artificial Intelligence for Industries (AI4I)","","","","","","","","","","","","","","",""
"2KMYQSQ5","preprint","2024","Jalayer, Reza; Jalayer, Masoud; Mor, Andrea; Orsenigo, Carlotta; Vercellis, Carlo","Evaluating deep learning models for fault diagnosis of a rotating machinery with epistemic and aleatoric uncertainty","","","","10.48550/arXiv.2412.18980","http://arxiv.org/abs/2412.18980","Uncertainty-aware deep learning (DL) models recently gained attention in fault diagnosis as a way to promote the reliable detection of faults when out-of-distribution (OOD) data arise from unseen faults (epistemic uncertainty) or the presence of noise (aleatoric uncertainty). In this paper, we present the first comprehensive comparative study of state-of-the-art uncertainty-aware DL architectures for fault diagnosis in rotating machinery, where different scenarios affected by epistemic uncertainty and different types of aleatoric uncertainty are investigated. The selected architectures include sampling by dropout, Bayesian neural networks, and deep ensembles. Moreover, to distinguish between in-distribution and OOD data in the different scenarios two uncertainty thresholds, one of which is introduced in this paper, are alternatively applied. Our empirical findings offer guidance to practitioners and researchers who have to deploy real-world uncertainty-aware fault diagnosis systems. In particular, they reveal that, in the presence of epistemic uncertainty, all DL models are capable of effectively detecting, on average, a substantial portion of OOD data across all the scenarios. However, deep ensemble models show superior performance, independently of the uncertainty threshold used for discrimination. In the presence of aleatoric uncertainty, the noise level plays an important role. Specifically, low noise levels hinder the models’ ability to effectively detect OOD data. Even in this case, however, deep ensemble models exhibit a milder degradation in performance, dominating the others. These achievements, combined with their shorter inference time, make deep ensemble architectures the preferred choice.","2024-12-25","2025-05-30 15:45:41","2025-05-31 10:41:44","2025-05-30 15:45:41","","","","","","","","","","","","arXiv","","en","","","","","arXiv.org","","arXiv:2412.18980 [cs]","<div data-schema-version=""9""><p>Fault classification paper using CWRU. Interesting approach on comparing different architectures but keeping basically a deep ensemble of NN, CNN and LSTM network. Training with ‘in-distribution’ data and then validating and testing the model with the out-of-distribution data (faults) to give a confidence score</p> </div>","/Users/Adri/Library/CloudStorage/GoogleDrive-adria.molero@upc.edu/Mi unidad/Zotero/storage/BBGVEIA7/Jalayer et al. - 2024 - Evaluating deep learning models for fault diagnosi.pdf; ","notion://www.notion.so/Jalayer-et-al-2024-2033c3c2f8f28122af87e04b6c639693","Fault classification; notion; 1D input; Classified; Read; bearings; CNN; LSTM; Bayesian network; Ensemble; RPlan: A","Computer Science - Machine Learning","","","","","","","","","","","","","","","","","","","arXiv:2412.18980","","","","","","","","","","","","","","","","","","","","","","","","","","",""
